{
  "schema_version": "1.0",
  "university_code": "bseu",
  "source": {
    "url": "https://bseu.by/abiturient/xml/1.xml",
    "checked_at": "2026-07-16T22:38:11+03:00",
    "http_status": 200,
    "source_updated_at": "2026-07-16T18:00:00+03:00",
    "structure": "DATAPACKET/ROWDATA/ROW",
    "scope": "active_admission_competition_table"
  },
  "derivation": {
    "candidate_key_order": [
      "source_identity.specialty_id",
      "source_identity.study_form_id",
      "source_identity.funding_id"
    ],
    "program_deduplication": "Use official code when sourced; otherwise university plus normalized name. Reject normalized-name collisions for manual review.",
    "offering_deduplication": "Program plus admission year plus canonical study form plus funding type; retain source form and funding ids as evidence.",
    "study_form_mapping": {
      "1": "full_time",
      "2": "part_time",
      "5": "other",
      "6": "distance",
      "7": "other"
    },
    "funding_mapping": {
      "18": "budget",
      "19": "paid"
    }
  },
  "candidates": [
    {
      "candidate_key": "bseu:2026:spid-5:form-1:funding-18",
      "source_identity": {
        "specialty_id": "5",
        "faculty_id": "1",
        "study_form_id": "1",
        "funding_id": "18"
      },
      "program_name": "Государственное управление и экономика",
      "specialty_code": null,
      "specialization_profile": null,
      "faculty": "Экономики и менеджмента",
      "study_form": "дневная",
      "funding_type": "budget",
      "admission_year": 2026,
      "admission_plan": 10,
      "official_source_url": "https://bseu.by/abiturient/xml/1.xml",
      "supplemental_official_source_urls": [],
      "source_checked_at": "2026-07-16T22:38:11+03:00",
      "source_updated_at": "2026-07-16T18:00:00+03:00",
      "status": "confirmed",
      "reasons": [
        "Official XML row key spid=5, frmid=1, IDFINANCE=18 is unique in the checked capture.",
        "Admission plan is taken from PlanBudj for the row's explicit funding code.",
        "The normalized program name occurs under exactly one source spid in the checked capture."
      ],
      "warnings": [
        "The competition XML does not publish an official specialty code.",
        "The competition XML does not publish a specialization or profile."
      ],
      "proposed_program_identity": {
        "match_key": "bseu|normalized-name|государственное управление и экономика",
        "strategy": "university_and_normalized_name",
        "source_spid": "5"
      },
      "proposed_program_offering_identity": {
        "match_key": "bseu|normalized-name|государственное управление и экономика|2026|full_time|budget",
        "program_match_key": "bseu|normalized-name|государственное управление и экономика",
        "admission_year": 2026,
        "study_form": "full_time",
        "funding_type": "budget"
      }
    },
    {
      "candidate_key": "bseu:2026:spid-5:form-1:funding-19",
      "source_identity": {
        "specialty_id": "5",
        "faculty_id": "1",
        "study_form_id": "1",
        "funding_id": "19"
      },
      "program_name": "Государственное управление и экономика",
      "specialty_code": null,
      "specialization_profile": null,
      "faculty": "Экономики и менеджмента",
      "study_form": "дневная",
      "funding_type": "paid",
      "admission_year": 2026,
      "admission_plan": 10,
      "official_source_url": "https://bseu.by/abiturient/xml/1.xml",
      "supplemental_official_source_urls": [],
      "source_checked_at": "2026-07-16T22:38:11+03:00",
      "source_updated_at": "2026-07-16T18:00:00+03:00",
      "status": "confirmed",
      "reasons": [
        "Official XML row key spid=5, frmid=1, IDFINANCE=19 is unique in the checked capture.",
        "Admission plan is taken from PlanVneBudj for the row's explicit funding code.",
        "The normalized program name occurs under exactly one source spid in the checked capture."
      ],
      "warnings": [
        "The competition XML does not publish an official specialty code.",
        "The competition XML does not publish a specialization or profile."
      ],
      "proposed_program_identity": {
        "match_key": "bseu|normalized-name|государственное управление и экономика",
        "strategy": "university_and_normalized_name",
        "source_spid": "5"
      },
      "proposed_program_offering_identity": {
        "match_key": "bseu|normalized-name|государственное управление и экономика|2026|full_time|paid",
        "program_match_key": "bseu|normalized-name|государственное управление и экономика",
        "admission_year": 2026,
        "study_form": "full_time",
        "funding_type": "paid"
      }
    },
    {
      "candidate_key": "bseu:2026:spid-6:form-1:funding-18",
      "source_identity": {
        "specialty_id": "6",
        "faculty_id": "22",
        "study_form_id": "1",
        "funding_id": "18"
      },
      "program_name": "Экономическая информатика",
      "specialty_code": "6-05-0311-05",
      "specialization_profile": null,
      "faculty": "Цифровой экономики",
      "study_form": "дневная",
      "funding_type": "budget",
      "admission_year": 2026,
      "admission_plan": 25,
      "official_source_url": "https://bseu.by/abiturient/xml/1.xml",
      "supplemental_official_source_urls": [
        "https://bseu.by/russian/abiturient/tsp2026.pdf"
      ],
      "source_checked_at": "2026-07-16T22:38:11+03:00",
      "source_updated_at": "2026-07-16T18:00:00+03:00",
      "status": "confirmed",
      "reasons": [
        "Official XML row key spid=6, frmid=1, IDFINANCE=18 is unique in the checked capture.",
        "Admission plan is taken from PlanBudj for the row's explicit funding code.",
        "The normalized program name occurs under exactly one source spid in the checked capture.",
        "Official BSEU 2026 plan evidence confirms code 6-05-0311-05 for Economic Informatics."
      ],
      "warnings": [
        "The competition XML does not publish a specialization or profile."
      ],
      "proposed_program_identity": {
        "match_key": "bseu|code|6-05-0311-05",
        "strategy": "official_code",
        "source_spid": "6"
      },
      "proposed_program_offering_identity": {
        "match_key": "bseu|code|6-05-0311-05|2026|full_time|budget",
        "program_match_key": "bseu|code|6-05-0311-05",
        "admission_year": 2026,
        "study_form": "full_time",
        "funding_type": "budget"
      }
    },
    {
      "candidate_key": "bseu:2026:spid-6:form-1:funding-19",
      "source_identity": {
        "specialty_id": "6",
        "faculty_id": "22",
        "study_form_id": "1",
        "funding_id": "19"
      },
      "program_name": "Экономическая информатика",
      "specialty_code": "6-05-0311-05",
      "specialization_profile": null,
      "faculty": "Цифровой экономики",
      "study_form": "дневная",
      "funding_type": "paid",
      "admission_year": 2026,
      "admission_plan": 60,
      "official_source_url": "https://bseu.by/abiturient/xml/1.xml",
      "supplemental_official_source_urls": [
        "https://bseu.by/russian/abiturient/tsp2026.pdf"
      ],
      "source_checked_at": "2026-07-16T22:38:11+03:00",
      "source_updated_at": "2026-07-16T18:00:00+03:00",
      "status": "confirmed",
      "reasons": [
        "Official XML row key spid=6, frmid=1, IDFINANCE=19 is unique in the checked capture.",
        "Admission plan is taken from PlanVneBudj for the row's explicit funding code.",
        "The normalized program name occurs under exactly one source spid in the checked capture.",
        "Official BSEU 2026 plan evidence confirms code 6-05-0311-05 for Economic Informatics."
      ],
      "warnings": [
        "The competition XML does not publish a specialization or profile."
      ],
      "proposed_program_identity": {
        "match_key": "bseu|code|6-05-0311-05",
        "strategy": "official_code",
        "source_spid": "6"
      },
      "proposed_program_offering_identity": {
        "match_key": "bseu|code|6-05-0311-05|2026|full_time|paid",
        "program_match_key": "bseu|code|6-05-0311-05",
        "admission_year": 2026,
        "study_form": "full_time",
        "funding_type": "paid"
      }
    },
    {
      "candidate_key": "bseu:2026:spid-17:form-6:funding-19",
      "source_identity": {
        "specialty_id": "17",
        "faculty_id": "11",
        "study_form_id": "6",
        "funding_id": "19"
      },
      "program_name": "Бухгалтерский учет, анализ и аудит",
      "specialty_code": null,
      "specialization_profile": null,
      "faculty": "\"Высшая школа управления и бизнеса\"",
      "study_form": "заочная (дистанционная)",
      "funding_type": "paid",
      "admission_year": 2026,
      "admission_plan": 30,
      "official_source_url": "https://bseu.by/abiturient/xml/1.xml",
      "supplemental_official_source_urls": [],
      "source_checked_at": "2026-07-16T22:38:11+03:00",
      "source_updated_at": "2026-07-16T18:00:00+03:00",
      "status": "needs_review",
      "reasons": [
        "Official XML row key spid=17, frmid=6, IDFINANCE=19 is unique in the checked capture.",
        "Admission plan is taken from PlanVneBudj for the row's explicit funding code.",
        "Program identity is blocked pending official evidence that resolves the normalized-name collision."
      ],
      "warnings": [
        "The competition XML does not publish an official specialty code.",
        "The competition XML does not publish a specialization or profile.",
        "The same normalized program name occurs under source spid values 17, 140; do not merge or split Program records without official code/profile evidence."
      ],
      "proposed_program_identity": {
        "match_key": null,
        "strategy": "manual_review_required",
        "source_spid": "17"
      },
      "proposed_program_offering_identity": {
        "match_key": null,